,id,conversation_id,created_at,date,time,timezone,user_id,username,name,place,tweet,language,mentions,urls,photos,replies_count,retweets_count,likes_count,hashtags,cashtags,link,retweet,quote_url,video,thumbnail,near,geo,source,user_rt_id,user_rt,retweet_id,reply_to,retweet_date,translate,trans_src,trans_dest
614,1418776962051366915,1418776962051366915,2021-07-24 03:36:02 UTC,2021-07-24,03:36:02,0,1174242688360689669,naaufrzka,nayyy,,virus varian delta ini kayaknya nyebarnya cpt bgt ya makanya angka positif naik mulu,in,[],[],[],0,0,0,[],[],https://twitter.com/naaufrzka/status/1418776962051366915,False,,0,,,,,,,,[],,,,
615,1418634977994936325,1418627439421321216,2021-07-23 18:11:50 UTC,2021-07-23,18:11:50,0,458498079,kurokaitou,Firstiar Noorwinanto,,"@oktalinee Saya udah prokes begini setahun setengah aja bisa apes kena. Apalagi sekarang ini udah makin ganas penyebarannya. Di atas 70% angka positif baru dari varian delta. Lethality masih sama, tapi lebih contagious. Harus lebih waspada. Terutama jk di rumah ada lansia dan/atau comorbid.",in,[],[],[],0,0,0,[],[],https://twitter.com/KuroKaitou/status/1418634977994936325,False,,0,,,,,,,,"[{'screen_name': 'oktalinee', 'name': 'dunkin isi stroberi', 'id': '726448567884255233'}]",,,,
616,1418559280001679365,1418559280001679365,2021-07-23 13:11:02 UTC,2021-07-23,13:11:02,0,79130206,jpnncom,JPNN.com,,"Angka baru itu berdasarkan data yang diambil antara 20 Juni-17 Juli, bersamaan dengan penyebaran varian Delta di Israel. #vaksincovid-19  https://t.co/fs1SqUasLN",in,[],['https://m.jpnn.com/news/varian-delta-merajalela-israel-sebut-efektivitas-vaksin-pfizer-hanya-39-persen'],[],0,0,3,['vaksincovid'],[],https://twitter.com/jpnncom/status/1418559280001679365,False,,0,,,,,,,,[],,,,
617,1418529728026210305,1418504312162963457,2021-07-23 11:13:36 UTC,2021-07-23,11:13:36,0,2879394787,hanrena_bts1031,여름소녀✜⁷ 🧈❄,,"@nuicemedia Yang bikin serem seminggu ini bukan kenaikan angka kasus baru per hari, tapi kematian bener-bener naik terus selama delta menyebar",in,[],[],[],0,1,1,[],[],https://twitter.com/hanrena_bts1031/status/1418529728026210305,False,,0,,,,,,,,"[{'screen_name': 'nuicemedia', 'name': 'Nuice Media', 'id': '929274077323259905'}]",,,,
618,1418497630775115776,1418497630775115776,2021-07-23 09:06:04 UTC,2021-07-23,09:06:04,0,456426648,merdekadotcom,Merdeka.com,,Varian Delta Bikin Kasus Covid-19 di Padang Masih Tinggi: Kasus penyebaran Covid-19 di Kota Padang masih menunjukkan angka yang tinggi dalam beberapa hari belakang. Salah satu penyebabnya adalah masuknya varian Delta ke Sumatera Barat.  https://t.co/cZxWON1i67,in,[],['http://dlvr.it/S4Gdxp'],[],0,0,1,[],[],https://twitter.com/merdekadotcom/status/1418497630775115776,False,,0,,,,,,,,[],,,,
619,1418477231664508929,1418477231664508929,2021-07-23 07:45:00 UTC,2021-07-23,07:45:00,0,23343960,kompascom,Kompas.com,,"Kepala Dinas Kesehatan Kota Padang Feri Mulyani mengatakan, risiko penularan dari varian delta ini lebih cepat, sehingga menyebabkan tingginya angka positif Covid-19 di Kota Padang. | #Regional    https://t.co/QQwnZw7cje",in,[],['https://regional.kompas.com/read/2021/07/23/113727678/varian-delta-sudah-masuk-kota-padang-lebih-menular-ini-cara-agar-tak-meluas'],[],0,4,6,['regional'],[],https://twitter.com/kompascom/status/1418477231664508929,False,,0,,,,,,,,[],,,,
620,1418451416805347330,1418451416805347330,2021-07-23 06:02:25 UTC,2021-07-23,06:02:25,0,304809657,dimasklvn,Dimas Kelvin,,"Orang lihat India parah lalu nganggep penanganan buruk.  Sekarang Delta varian udah nyebar kemana mana, angka naik lagi. Baru pada kaget lagi.",in,[],[],[],1,0,0,[],[],https://twitter.com/dimasklvn/status/1418451416805347330,False,,0,,,,,,,,[],,,,
621,1418388931947556865,1418296068870004739,2021-07-23 01:54:08 UTC,2021-07-23,01:54:08,0,43865142,darkyojimbo,DrYojimbo 🇮🇩,,"@susipudjiastuti Luhut mengatakan, banyak yang berpikir bahwa kasus Covid-19 dapat diturunkan dengan hanya memakai masker. Padahal, kenyataannya virus corona varian Delta menyebar dengan begitu cepat.  Bila semua memakai masker dgn benar maka akan menurukan angka covid",in,[],[],[],0,0,0,[],[],https://twitter.com/Darkyojimbo/status/1418388931947556865,False,,0,,,,,,,,"[{'screen_name': 'susipudjiastuti', 'name': 'Susi Pudjiastuti', 'id': '2606229566'}]",,,,
622,1418386221445779458,1418386221445779458,2021-07-23 01:43:22 UTC,2021-07-23,01:43:22,0,817836195430342657,nadjib_178,🅖AIN🅕OLLOWERS 🅂INA🄶A senior captain ⒷusⒹriver,,Sering menunggu kabar baik dari 2 sahabat NAKES kita sdri @Ririe59647423  dan sdr @Dads1901  Moga penularan varian delta semakin berkurang. Angka kesembuhan semakin tinggi.,in,"[{'screen_name': 'dads1901', 'name': 'dads', 'id': '337622287'}]",[],[],9,4,27,[],[],https://twitter.com/Nadjib_178/status/1418386221445779458,False,,0,,,,,,,,[],,,,
623,1418360887744765954,1418360887744765954,2021-07-23 00:02:42 UTC,2021-07-23,00:02:42,0,980097559736721408,albertsolo2,Albert Solo,,Sejumlah negara di Eropa melaporkan adanya lonjakan kasus baru Covid-19 varian Delta di negaranya.Austria kemarin melaporkan adanya lonjakan jumlah kasus Covid-19 varian Delta dengan jumlah kasus mencapai angka 5000 kasus dalam waktu beberapa hari terakhir ini.,in,[],[],[],0,1,4,[],[],https://twitter.com/AlbertSolo2/status/1418360887744765954,False,,0,,,,,,,,[],,,,
624,1418212737092505618,1418212737092505618,2021-07-22 14:14:00 UTC,2021-07-22,14:14:00,0,124171593,tribunnews,Tribunnews.com,,"Wali Kota Duga Varian Delta Sudah Menyebar di Kendari, Bikin Angka Positif Covid-19 Meroket    https://t.co/tFNjN7pXDs via @tribunnews",in,"[{'screen_name': 'tribunnews', 'name': 'tribunnews.com', 'id': '124171593'}]",['https://sultra.tribunnews.com/2021/07/22/wali-kota-duga-varian-delta-sudah-menyebar-di-kendari-bikin-angka-positif-covid-19-meroket'],[],0,0,2,[],[],https://twitter.com/tribunnews/status/1418212737092505618,False,,0,,,,,,,,[],,,,
625,1418190529594990598,1418169372686782470,2021-07-22 12:45:45 UTC,2021-07-22,12:45:45,0,1246706038813802496,a3scandals,scandals a3,,"@Ndrews110611 Msh pandemi @jokowi  hdr di kawinan Atta,saat delta menggila @mohmahfudmd hdr di resepsi anak Sujiwotedjo,pjbt ke LN.Saat yg sm influencer memband angka kematian di Ind - UK ato Sing.  Sy tdk paham istilah org lap spt anda yg terpelajar,,,,,,tpi sy adl suara sunyi korban yg jatuh",in,"[{'screen_name': 'jokowi', 'name': 'joko widodo', 'id': '366987179'}, {'screen_name': 'mohmahfudmd', 'name': 'mahfud md', 'id': '282006208'}]",[],[],1,0,0,[],[],https://twitter.com/A3Scandals/status/1418190529594990598,False,,0,,,,,,,,"[{'screen_name': 'Ndrews110611', 'name': 'Ndrews11611', 'id': '1176673445263765504'}]",,,,
626,1418179809281122304,1418178464356646916,2021-07-22 12:03:09 UTC,2021-07-22,12:03:09,0,87935418,temihaitami,Maulana Haitami,,"@FaheemYounus Buset dah ade berita penting: paksin pfizer ame Astrazeneca mantep buset buat lawan varian delta.  Ini kebukti naeknya angka covid di Inggris, Prancis, Spanyol ame Portugal tapi yang koit kaga ada peningkatannye.  Tinggal pilih dah, ente mao paksin ape mao rebahan di rumah sakit.",in,[],[],[],2,8,28,[],[],https://twitter.com/temihaitami/status/1418179809281122304,False,,0,,,,,,,,"[{'screen_name': 'FaheemYounus', 'name': 'Faheem Younus, MD', 'id': '389313566'}]",,,,
627,1418155263706628096,1418016611546525696,2021-07-22 10:25:37 UTC,2021-07-22,10:25:37,0,1312445982471200768,trimo78,Trimo78,,@eko_kuntadhi Pemuda pemuda generasi kadrun taliban...kalo kelamaan dibiarkan virusnya bakal menyebar...cluster nya tau kan eropa barat ma  jekardah...persis angka varian delta jumlah virus kadrunnya...,in,[],[],[],0,0,0,[],[],https://twitter.com/trimo78/status/1418155263706628096,False,,0,,,,,,,,"[{'screen_name': 'eko_kuntadhi', 'name': 'eko', 'id': '1383803634853421060'}]",,,,
628,1418155074094731265,1418155074094731265,2021-07-22 10:24:52 UTC,2021-07-22,10:24:52,0,1070530864927322112,mizimatic,Mohd Tirmidzi,,"Kes Putrajaya dh cecah 3 angka, padahal Putrajaya ni lagi kecik dr Perlis. Aeon Alamanda pun dh seminggu tutup, dr mana dtg yg positif2 ni? Ada kluster varian delta ke di Putrajaya? @Twt_Putrajaya  https://t.co/SdWRkeZGwi",in,"[{'screen_name': 'twt_putrajaya', 'name': 'twt_putrajayamy', 'id': '2305911194'}]",[],['https://pbs.twimg.com/media/E65MhJPUUAA94-3.jpg'],0,0,0,[],[],https://twitter.com/mizimatic/status/1418155074094731265,False,,1,https://pbs.twimg.com/media/E65MhJPUUAA94-3.jpg,,,,,,,[],,,,
629,1418130836486905858,1418130836486905858,2021-07-22 08:48:33 UTC,2021-07-22,08:48:33,0,1320253102012813312,tribunsultra,Tribunnews Sultra,,"Wali Kota Duga Varian Delta Sudah Menyebar di Kendari, Bikin Angka Positif Covid-19 Meroket    https://t.co/3cdnNql4Qd lewat @tribunsultra",in,"[{'screen_name': 'tribunsultra', 'name': 'tribunnews sultra', 'id': '1320253102012813312'}]",['https://sultra.tribunnews.com/2021/07/22/wali-kota-duga-varian-delta-sudah-menyebar-di-kendari-bikin-angka-positif-covid-19-meroket'],[],0,0,0,[],[],https://twitter.com/tribunsultra/status/1418130836486905858,False,,0,,,,,,,,[],,,,
630,1418128618174091267,1418128608619499521,2021-07-22 08:39:44 UTC,2021-07-22,08:39:44,0,804246011837190145,humas_jogja,Humas Pemda DIY,,Penyediaan tempat untuk Isoter menjadi sangat penting guna menekan angka kasus Covid-19 mengingat varian Delta dengan penularan yang sangat cepat saat ini telah menyerbar. #GubernurDIY #PPKMLevel4 #JogjaBisa,in,[],[],[],1,0,0,"['gubernurdiy', 'ppkmlevel4', 'jogjabisa']",[],https://twitter.com/humas_jogja/status/1418128618174091267,False,,0,,,,,,,,[],,,,
631,1418046728817709061,1418046728817709061,2021-07-22 03:14:20 UTC,2021-07-22,03:14:20,0,595641773,ygwjynt,darkmode.,,"Varian Delta mulai menyebar ke Australia dan Eropa, angka penularan Covid19 perlahan mulai naik kembali. Perancis mempertimbangkan untuk segera lockdown.",in,[],[],[],0,0,0,[],[],https://twitter.com/ygwjynt/status/1418046728817709061,False,,0,,,,,,,,[],,,,
632,1418011176399605763,1417950660914413570,2021-07-22 00:53:04 UTC,2021-07-22,00:53:04,0,88403083,britpop1990,Hey Now!!,,"@chumaidijusuf @korantempo Balik lagi atas nama data dan angka bang, entah itu mau dinaikan atau diturunkan Buat saya, janggal gk sh yg varian delta. 2 hari stlh diumumkan lonjakannya 70an persen, daerah saya yg 1 kasus ketika dirilis malah mjd 20an kasus. Dan yg jls byk permainan, tp entah demi apa..",in,[],[],[],0,0,0,[],[],https://twitter.com/britpop1990/status/1418011176399605763,False,,0,,,,,,,,"[{'screen_name': 'chumaidijusuf', 'name': 'chumaidijusuf', 'id': '1137905747725963264'}, {'screen_name': 'korantempo', 'name': 'Koran Tempo', 'id': '20963426'}]",,,,
633,1418008993662869512,1418008993662869512,2021-07-22 00:44:24 UTC,2021-07-22,00:44:24,0,1356239976782917632,samsularifffin,💤,,"Fakta bahwa  mengarah ke Herd immunity “alamiah” 1. Jumlah vaksin terbatas 2. Vaksinasi justru memicu kerumunan 3. Ketaatan prokes yg rendah 4. Varian delta mendominasi 5. Coba di cek di desa2 byk berita kematian dirumah apa nggak? 6. Angka kunjungan demam, nyeri tenggorokan ↗️↗️",in,[],[],[],1,1,3,[],[],https://twitter.com/samsularifffin/status/1418008993662869512,False,https://twitter.com/detikcom/status/1418002522871111680,0,,,,,,,,[],,,,
634,1417862951763988481,1417862951763988481,2021-07-21 15:04:04 UTC,2021-07-21,15:04:04,0,118371948,harian_jogja,Harian Jogja,,Menteri Luhut: Akui Delta Covid Bikin Angka Kematian Naik  https://t.co/ilH7ok70yE #beritajogja #jogja #jogjaistimewa  https://t.co/xF2qDxMEfx,in,[],['https://news.harianjogja.com/read/2021/07/21/500/1077785/menteri-luhut-akui-delta-covid-bikin-angka-kematian-naik?utm_source=dlvr.it&utm_medium=twitter'],['https://pbs.twimg.com/media/E61C10HVEAUqsnG.jpg'],0,0,2,"['beritajogja', 'jogja', 'jogjaistimewa']",[],https://twitter.com/Harian_Jogja/status/1417862951763988481,False,,1,https://pbs.twimg.com/media/E61C10HVEAUqsnG.jpg,,,,,,,[],,,,
635,1417834595244859398,1417834595244859398,2021-07-21 13:11:24 UTC,2021-07-21,13:11:24,0,1155781907109621760,ariepurwanto_,Arie Purwanto #LaparBolehYangPentingProkes,,"Herd immunity mestinya dikalkulasikan pada level wilayah aglomerasi atau pulau atau nasional. Pun, dengan adanya varian Delta, angka target imunitas harusnya di-update (ditingkatkan). Target saat ini ditetapkan dengan asumsi varian awal yang infection rate lebih rendah",in,[],[],[],0,0,0,[],[],https://twitter.com/AriePurwanto_/status/1417834595244859398,False,,0,,,,,,,,[],,,,
636,1417826837724467203,1417826837724467203,2021-07-21 12:40:34 UTC,2021-07-21,12:40:34,0,118646322,bisniscom,Bisnis.com,,Menko Luhut: Delta Covid Bikin Angka Kematian Naik  https://t.co/fEJqj2ikLb,in,[],['https://kabar24.bisnis.com/read/20210721/15/1420260/menko-luhut-delta-covid-bikin-angka-kematian-naik?utm_source=dlvr.it&utm_medium=twitter'],[],1,1,2,[],[],https://twitter.com/Bisniscom/status/1417826837724467203,False,,0,,,,,,,,[],,,,
637,1417810887688130564,1417810887688130564,2021-07-21 11:37:11 UTC,2021-07-21,11:37:11,0,875985613,isanmahendra7,Isan,,"PPKM Darurat gak nurunin angka covid, kenapa? Ya karena varian Delta ini gak bisa ngeliat orang ngumpul. Nularnya jauh lebih cepet dr pd varian2 sebelumnya. Kalau emang pemerintah beneran serius nurunin angka covid mah jangan perpanjang PPKM, gak gunaaa!!",in,[],[],[],1,0,3,[],[],https://twitter.com/isanmahendra7/status/1417810887688130564,False,,0,,,,,,,,[],,,,
638,1417669756555984897,1417669756555984897,2021-07-21 02:16:23 UTC,2021-07-21,02:16:23,0,1734712436,najeaman,anda,,"Kemarin gue baca salah satu ciri varian delta adalah angka CT yg rendah, dan kemarin waktu + angka CT gue lumayan bisa dikatakan rendah walau gak single digit juga. Sempet baca juga, ada faktor biologis yang mempengaruhi ringan-berat gejala covid. Jadi itulah kenapa bisa sampe...",in,[],[],[],1,0,0,[],[],https://twitter.com/najeaman/status/1417669756555984897,False,https://twitter.com/gadeblazz/status/1417335565935017992,0,,,,,,,,[],,,,
639,1417612841553514498,1417612841553514498,2021-07-20 22:30:14 UTC,2021-07-20,22:30:14,0,1399501770817097729,andreas68565894,Andreas N.,,"Pengalaman dari gelombang pertama menunjukkan jika total kasus aftif lebih dari 100 ribu, RS mulai kewalahan sehingga angka kematian bisa ratusan per hari. Itu sebelum adanya varian Delta. PPKM harus diperpanjang hingga RS bisa menangani pasien dengan baik.",in,[],[],[],0,0,0,[],[],https://twitter.com/Andreas68565894/status/1417612841553514498,False,,0,,,,,,,,[],,,,
640,1417587516530565121,1417454381792776193,2021-07-20 20:49:36 UTC,2021-07-20,20:49:36,0,997779086926790656,mutajir_mohamat,Mohamat Mutajir,,"@AdamPrabata Ane sangat gak yakin dengan hasil penelitian ini, dimana antibodi penyintas dapat berpengaruh angka penularan dan kematian terhadap varian delta, bahkan jika terjadi mutasi yang lebih letal..",in,[],[],[],0,0,0,[],[],https://twitter.com/mutajir_mohamat/status/1417587516530565121,False,,0,,,,,,,,"[{'screen_name': 'AdamPrabata', 'name': 'dr. Adam Prabata', 'id': '378057814'}]",,,,
641,1417493862290006016,1417493862290006016,2021-07-20 14:37:27 UTC,2021-07-20,14:37:27,0,67246185,hii2305,Elle Sntso,,Kyaknya aku kapanan kena varian Delta deh  Yg pcr kmarin itu juga udah d angka sembuh :/,in,[],[],[],1,0,0,[],[],https://twitter.com/hii2305/status/1417493862290006016,False,,0,,,,,,,,[],,,,
642,1417434760872304640,1417415578713661442,2021-07-20 10:42:36 UTC,2021-07-20,10:42:36,0,198494864,egiadrianta,egiadrianta,,"@eko_kuntadhi Klo covid varian delta,  DELTA LOH YAA DELTA YG DARI INDIA, bisa masuk ke Indonesia yg mengakibatkan angka kematian kita no 1 di duniaaaa  Kita tahu kenapa bisa terjadi...",in,[],[],[],0,0,0,[],[],https://twitter.com/egiadrianta/status/1417434760872304640,False,,0,,,,,,,,"[{'screen_name': 'eko_kuntadhi', 'name': 'eko', 'id': '1383803634853421060'}]",,,,
643,1417377800638537728,1417377800638537728,2021-07-20 06:56:15 UTC,2021-07-20,06:56:15,0,154761007,aarianti,AliaAAAA,,Sebenarnya ledakan kasus di NSW ini bisa jadi contoh seberapa infeksiusnya varian Delta ini. Ga kebayang angka infeksi asli di Indonesia kalau testingnya serius. Jangan2 10 kali lipat yg dilaporkan 😔😔,in,[],[],[],0,0,0,[],[],https://twitter.com/aarianti/status/1417377800638537728,False,https://twitter.com/antaranews/status/1417351919043977217,0,,,,,,,,[],,,,
644,1417308062671540225,1417308062671540225,2021-07-20 02:19:09 UTC,2021-07-20,02:19:09,0,2251383210,ahmadnormaulana,Ahmad Nor Maulana Af,,"Covid Varian Delta Masuk Mimika, Jadi Pemicu Angka Kematian Tinggi  https://t.co/Si30MO3AJf  https://t.co/9xutWCT9je",in,[],['http://dlvr.it/S43Jk0'],['https://pbs.twimg.com/media/E6tKLCUVkAQLl-S.jpg'],0,0,0,[],[],https://twitter.com/AhmadNorMaulana/status/1417308062671540225,False,,1,https://pbs.twimg.com/media/E6tKLCUVkAQLl-S.jpg,,,,,,,[],,,,
645,1417153898553303042,1416948180877447169,2021-07-19 16:06:33 UTC,2021-07-19,16:06:33,0,1250422870255140873,rommysudiyarto,Rian,,"@Ayang_Utriza @MaulanaLevine Kalau mau sembuh dari Covid 19 dan varian Delta minumlah Habspro, capsul herbal pemusnah Covid 19 dan varian Delta,membantu Pemerintah menurunkan angka Covid 19 dan varian Delta pesan WA 085716410400  https://t.co/7JH0bwIZTe",in,[],[],['https://pbs.twimg.com/media/E6q99azVIAEy_lG.jpg'],0,0,0,[],[],https://twitter.com/RommySudiyarto/status/1417153898553303042,False,,1,https://pbs.twimg.com/media/E6q99azVIAEy_lG.jpg,,,,,,,"[{'screen_name': 'Ayang_Utriza', 'name': 'Ayang Utriza Yakin', 'id': '184007180'}]",,,,
646,1417130025871044609,1417130025871044609,2021-07-19 14:31:41 UTC,2021-07-19,14:31:41,0,373792885,izzwanraffi,iwan 🏴,,"Bodoh babi ah tukar tukar SOP. Dengan varian delta kau, dengan case 5 angka setiap hari 🤣🤣",in,[],[],[],0,0,0,[],[],https://twitter.com/izzwanraffi/status/1417130025871044609,False,,0,,,,,,,,[],,,,
647,1417123822721855490,1417123822721855490,2021-07-19 14:07:02 UTC,2021-07-19,14:07:02,0,1303629944367398912,satpolpp_diy,SatpolppDIY,,"Angka terkonfirmasi positif C-19 di DIY , 18 Juli 2021 sebanyak 2.119 orangKemarin telah disampaikan Gubernur DIY bahwa telah terdapat 20 orang terpapar varian Delta di DIY dari Pemeriksaan terhadap 25 spesimen.Mari Waspada, Taati Prokes, Bijak dalam beraktifita  https://t.co/asx7t78jDO",in,[],[],['https://pbs.twimg.com/media/E6qimbmUUAEg3Kd.jpg'],1,0,0,[],[],https://twitter.com/Satpolpp_DIY/status/1417123822721855490,False,,1,https://pbs.twimg.com/media/E6qimbmUUAEg3Kd.jpg,,,,,,,[],,,,
648,1417101559264026630,1417101249560727556,2021-07-19 12:38:34 UTC,2021-07-19,12:38:34,0,1199598556702625792,rezkisobri,water law,,"Alasannya jelas, karena Covid-19 varian delta sedang merajalela dan angka kasus positif serta kematian tinggi:   https://t.co/ib5jxiabNY",in,[],['https://twitter.com/sociotalker/status/1417006766282350594?s=19'],[],1,0,0,[],[],https://twitter.com/RezkiSobri/status/1417101559264026630,False,https://twitter.com/sociotalker/status/1417006766282350594?s=19,0,,,,,,,,[],,,,
649,1417011372047564801,1417011372047564801,2021-07-19 06:40:12 UTC,2021-07-19,06:40:12,0,1293138953369862146,eksissosmed,Viral Media,,Langkah tegas telah di pilih guna menekan angka penyebaran Covid-19 varian delta ini yang faktanya penyebarannya lebih cepat terbukti ketika penyebaran di India.  #DampakBaikPPKMDarurat Patuhi Prokes PPKM PPKM Pulihkan Indonesia  https://t.co/v6uWqDqcFT,in,[],[],['https://pbs.twimg.com/media/E6o7-MvVIAAA1KY.jpg'],1,2,3,['dampakbaikppkmdarurat'],[],https://twitter.com/EksisSosmed/status/1417011372047564801,False,,1,https://pbs.twimg.com/media/E6o7-MvVIAAA1KY.jpg,,,,,,,[],,,,
650,1416957836928569344,1416957836928569344,2021-07-19 03:07:28 UTC,2021-07-19,03:07:28,0,65991060,hidcom,Hidayatullah.com,,"Coronavirus varian Delta sekarang menjadi penyebab dominan infeksi penyebab Covid-19, sementara varian itu mendorong naik angka kematian di Amerika Serikat di kalangan orang yang belum divaksinasi  https://t.co/V6a9XOUw7e",in,[],['https://www.hidayatullah.com/berita/internasional/read/2021/07/17/212099/jadi-varian-dominan-coronavirus-delta-dongkrak-kematian-covid-19-di-as.html'],[],1,2,4,[],[],https://twitter.com/hidcom/status/1416957836928569344,False,,0,,,,,,,,[],,,,
651,1416954251213819905,1416954251213819905,2021-07-19 02:53:13 UTC,2021-07-19,02:53:13,0,18129942,tempodotco,TEMPO.CO,,"Kuasa Hukum eks Pimpinan FPI Rizieq Shihab, Aziz Yanuar, memastikan kliennya dalam keadaan sehat walaupun saat ini angka penularan Covid-19 tengah meroket imbas dari munculnya varian Delta. #TempoMetro  https://t.co/dkkrfgXH8p",in,[],['https://bit.ly/3rjOeTh'],[],2,2,9,['tempometro'],[],https://twitter.com/tempodotco/status/1416954251213819905,False,,0,,,,,,,,[],,,,
652,1416952949205475334,1416513202628620288,2021-07-19 02:48:03 UTC,2021-07-19,02:48:03,0,450212616,naqibahmd11,Naqib Ahmad,,Vaksin Sinovac keatas Indonesia. Angka 20% tu agak tinggi. Kemungkinan varian Delta. Malaysia bila nak kaji utk booster shot? Jgn lambat sgt. Nnti stok lambat sampai.    https://t.co/ZsozA5chiH,in,[],['https://twitter.com/501Awani/status/1416918498064801795?s=19'],[],0,0,2,[],[],https://twitter.com/NaqibAhmd11/status/1416952949205475334,False,https://twitter.com/501Awani/status/1416918498064801795?s=19,0,,,,,,,,[],,,,
653,1416952730623430656,1416952730623430656,2021-07-19 02:47:11 UTC,2021-07-19,02:47:11,0,140292500,mujadidrais,Ahmad Imam M Rais,,"Insya Allah besok ada tugas jadi Imam dan Khotib Sholat Idul Adha. Hari ini rencana mau cari bahan khutbah.  Jamaahnya: anak-istri saja.  Ya, mengingat pandemi masih terjadi, varian Delta yg punya angka reproduksi 7 (1 menulari 7 orang lainnya) semakin aktif, mjaga diri (hifz..",in,[],[],[],1,0,0,[],[],https://twitter.com/mujadidrais/status/1416952730623430656,False,,0,,,,,,,,[],,,,
654,1416929948925796353,1416929948925796353,2021-07-19 01:16:39 UTC,2021-07-19,01:16:39,0,1266163382807224320,ferdinandhaean3,🇮🇩Ferdinand Hutahaean🇮🇩,,"Menurunkan angka positif covid apalagi dgn varian Delta ini bukanlah pekerjaan mudah seperti menurunkan statistik TBC.  Kerjasama Pemerintah dgn Rakyat dalam hal ini menjadi sgt penting. Pemerintah bekerja, Rakyat perduli dgn aturan. Tanpa kesadaran, kita akan lelah tanpa hasil.!",in,[],[],[],5,13,81,[],[],https://twitter.com/FerdinandHaean3/status/1416929948925796353,False,,0,,,,,,,,[],,,,
655,1416917874120159235,1416607951222099973,2021-07-19 00:28:40 UTC,2021-07-19,00:28:40,0,1297362611026059269,drpriono1,Juru Wabah 🇮🇩,,Diperkirakan 98% Delta di Indonesia. PPKM Darurat perlu dilanjutkan sampai angka HUNIAN RS dan Kematian menurun  signifikan.,in,[],[],[],3,5,22,[],[],https://twitter.com/drpriono1/status/1416917874120159235,False,,0,,,,,,,,[],,,,
656,1416910746798096388,1416910746798096388,2021-07-19 00:00:21 UTC,2021-07-19,00:00:21,0,1321042237942239233,riego168,🍀Ikhlas Menang🍀,,"Dari jauh terlihat 2 orang bapak² lagi serius ngobrol. Saya kira lagi ngomongin PPKM darurat , vaksinasi atau Covid 19 varian delta. Setelah dekat ternyata mereka lagi ngomongin angka². Bukan angka korban Covid. Lalu apa? Apa lagi kalau bukan angka² togel 😜",in,[],[],[],0,0,0,[],[],https://twitter.com/Riego168/status/1416910746798096388,False,,0,,,,,,,,[],,,,
657,1416826523189874689,1416826523189874689,2021-07-18 18:25:41 UTC,2021-07-18,18:25:41,0,1356214761784918021,partogimh,"Adi Partogi Simbolon,SH.,MH",,"angka kematian Covid 19 dengan Varian Delta, bahwa itu tidak dapat di pungkiri. tetapi yang sangat menyesak,bahwa sangat tega yang sudah memberlakukan PPKM, Ibu Pertiwi ingin membunuh rakyat Indonesia  yang lapar....??di mana hati Ibu Pertiwi",in,[],[],[],0,0,0,[],[],https://twitter.com/PartogiMh/status/1416826523189874689,False,,0,,,,,,,,[],,,,
658,1416714313440522244,1416714313440522244,2021-07-18 10:59:48 UTC,2021-07-18,10:59:48,0,1313381114459820032,poskotaofficial,POS KOTA,,Angka kematian akibat Covid-19 varian delta juga terus bertambah. Bahkan menurut sejumlah sumber mengungkapkan bahwa varian delta menyebabkan komplikasi pada penderitanya dengan gejala yang lebih parah.  Baca Selengkapnya ⬇️  https://t.co/uEPmlPOmTU,in,[],['https://poskota.co.id/2021/07/18/penderita-covid-19-pasca-sembuh-justru-rentan-alami-kerusakan-organ-penting-dari-liver-hingga-jantung-benarkah'],[],0,0,0,[],[],https://twitter.com/poskotaofficial/status/1416714313440522244,False,,0,,,,,,,,[],,,,
659,1416713876607930368,1416713876607930368,2021-07-18 10:58:04 UTC,2021-07-18,10:58:04,0,67281504,tsetiady,ˡᵘᵃʳ ʲᵃʷᵃ ˢⁱᵃᵍᵃ ᶜᵒᵛⁱᵈ 😷,,"orang liat angka hari ini, terus niat pulang kampung, kelar kita mas~~  orang jakarta pulang kampung bawa oleh2 virus varian delta, buat iduladha, modaro!",in,[],[],[],2,1,7,[],[],https://twitter.com/tsetiady/status/1416713876607930368,False,https://twitter.com/uradn/status/1416712734343778306,0,,,,,,,,[],,,,
660,1416711919545688065,1416711919545688065,2021-07-18 10:50:17 UTC,2021-07-18,10:50:17,0,2576569506,herditiya1,Penjaga Villa,,"Varian Delta memiliki angka reproduksi 7. Artinya, satu orang yang terinfeksi varian Delta bisa menularkan ke tujuh orang lain. Varian asli virus SARS-CoV-2 memiliki angka reproduksi 2,5.  Tapi, pemimpin dungu justru jauh lebih berbahaya dari varian apapun.",in,[],[],[],0,3,2,[],[],https://twitter.com/herditiya1/status/1416711919545688065,False,,0,,,,,,,,[],,,,
661,1416682990126596099,1416603497810649088,2021-07-18 08:55:20 UTC,2021-07-18,08:55:20,0,632251989,zul92p,Zul,,"@dayatia Utk covid varian delta ini mmg post effect nya yg lebih berbahaya 😥 pasca isoman 14 hari dan negatif terkadang masih tersisa sesak nafas bahkan saturasi oksigen masih jauh dibawah angka normal, hal ini yg membuat terkadang parah dan menjadi tdk tertolong 😭",in,[],[],[],1,0,5,[],[],https://twitter.com/zul92p/status/1416682990126596099,False,,0,,,,,,,,"[{'screen_name': 'dayatia', 'name': 'Tokugawa Ieyasu', 'id': '264104328'}]",,,,
